Information for device VideoRay Controller (VID=0x16C0 PID=0x27B5):

------------------------------
Connection Information:
------------------------------
Device current bus speed: FullSpeed
Device supports USB 1.1 specification
Device supports USB 2.0 specification
Device address: 0x0002
Current configuration value: 0x01
Number of open pipes: 1


------------------------------
Device Descriptor:
------------------------------
0x12	bLength
0x01	bDescriptorType
0x0200	bcdUSB
0x00	bDeviceClass      
0x00	bDeviceSubClass   
0x00	bDeviceProtocol   
0x40	bMaxPacketSize0   (64 bytes)
0x16C0	idVendor
0x27B5	idProduct
0x0121	bcdDevice
0x01	iManufacturer   "VideoRay, LLC"
0x02	iProduct        "VideoRay Controller"
0x03	iSerialNumber   "B71756"
0x01	bNumConfigurations


-------------------------
Configuration Descriptor:
-------------------------
0x09	bLength
0x02	bDescriptorType
0x0022	wTotalLength   (34 bytes)
0x01	bNumInterfaces
0x01	bConfigurationValue
0x00	iConfiguration
0x80	bmAttributes   (Bus-powered Device)
0x32	bMaxPower      (100 mA)

Interface Descriptor:
------------------------------
0x09	bLength
0x04	bDescriptorType
0x00	bInterfaceNumber
0x00	bAlternateSetting
0x01	bNumEndPoints
0x03	bInterfaceClass      (Human Interface Device Class)
0x00	bInterfaceSubClass   
0x00	bInterfaceProtocol   
0x00	iInterface

HID Descriptor:
------------------------------
0x09	bLength
0x21	bDescriptorType
0x0110	bcdHID
0x00	bCountryCode
0x01	bNumDescriptors
0x22	bDescriptorType   (Report descriptor)
0x0067	bDescriptorLength

Endpoint Descriptor:
------------------------------
0x07	bLength
0x05	bDescriptorType
0x81	bEndpointAddress  (IN endpoint 1)
0x03	bmAttributes      (Transfer: Interrupt / Synch: None / Usage: Data)
0x0020	wMaxPacketSize    (1 x 32 bytes)
0x04	bInterval         (4 frames)

Microsoft OS Descriptor is not available. Error code: 0x0000001F


--------------------------------
String Descriptor Table
--------------------------------
Index  LANGID  String
0x00   0x0000  0x0409 
0x01   0x0409  "VideoRay, LLC"
0x02   0x0409  "VideoRay Controller"
0x03   0x0409  "B71756"

------------------------------

Connection path for device: 
USB xHCI Compliant Host Controller
Root Hub
VideoRay Controller (VID=0x16C0 PID=0x27B5) Port: 1

Running on: Windows 10 or greater (Build Version 22631)

Brought to you by TDD v2.17.0, Feb 23 2021, 14:04:02